{
  "schema_name": "gunnchos.twin_state_bundle",
  "schema_version": "1.0.0",
  "run_id": "pixel-rehearsal-1784848985767",
  "site_id": "gary",
  "source_measurement": {
    "summary": {
      "n_samples": 60,
      "mean_latency_ms": 35.306033,
      "mean_jitter_ms": 8.501366372881355,
      "mean_packet_loss_pct": 0.0,
      "mean_upload_mbps": 0.0,
      "mean_download_mbps": 0.0,
      "dominant_network_type": "wifi",
      "workload_profile": "learn",
      "service_profile": "learn_continuity"
    },
    "sha256": "d65f0cb65fa7fb0f9ba973e8350cc277f22fc07626028a514b005ab98798fa46",
    "producer_repository": "edge-io-measurement-node",
    "producer_commit": "dd1a7ec18673263eb181ff51479a8249a6635989"
  },
  "service_demand": {
    "values": {
      "service_profile": "learn_continuity",
      "workload_profile": "learn",
      "latency_budget_ms": 150.0
    },
    "origin": "inferred"
  },
  "user_demands": [
    {
      "user_class": "learn",
      "priority": 2,
      "latency_budget_ms": 150.0,
      "bandwidth_mbps": 1.0,
      "origin": "inferred"
    }
  ],
  "connectivity_candidates": [
    {
      "network": "terrestrial",
      "available": true,
      "estimated_latency_ms": 35.306033,
      "estimated_capacity_mbps": 0.0,
      "origin": "measured"
    },
    {
      "network": "local_edge_wifi",
      "available": true,
      "estimated_latency_ms": 35.306033,
      "estimated_capacity_mbps": 0.0,
      "origin": "measured"
    },
    {
      "network": "degraded_local",
      "available": true,
      "estimated_latency_ms": 52.9590495,
      "estimated_capacity_mbps": 0.5,
      "origin": "inferred"
    },
    {
      "network": "ntn_fallback",
      "available": true,
      "estimated_latency_ms": 45.0,
      "estimated_capacity_mbps": 5.0,
      "origin": "configured"
    },
    {
      "network": "device_to_device",
      "available": false,
      "estimated_latency_ms": null,
      "estimated_capacity_mbps": null,
      "origin": "missing"
    },
    {
      "network": "offline_continuation",
      "available": true,
      "estimated_latency_ms": 0.0,
      "estimated_capacity_mbps": 0.0,
      "origin": "configured"
    }
  ],
  "network_state": {
    "values": {
      "dominant_network_type": "wifi",
      "mean_latency_ms": 35.306033,
      "mean_packet_loss_pct": 0.0,
      "mean_jitter_ms": 8.501366372881355
    },
    "origin": "measured"
  },
  "spectrum_availability": {
    "values": {
      "spectrum_budget_mhz": 20.0
    },
    "origin": "configured"
  },
  "compute_availability": {
    "values": {
      "local_edge": true,
      "cloud": true,
      "device": true,
      "compute_nodes": [
        {
          "id": "device",
          "capacity": 1.0
        },
        {
          "id": "local_edge",
          "capacity": 1.0
        },
        {
          "id": "cloud",
          "capacity": 1.0
        }
      ]
    },
    "origin": "inferred"
  },
  "mobility_state": {
    "values": {
      "class": "low_mobility_named_zone"
    },
    "origin": "configured"
  },
  "blockage_state": {
    "values": {
      "blocked": false
    },
    "origin": "missing"
  },
  "energy_constraints": {
    "values": {
      "energy_budget_j": 100.0,
      "mean_battery_pct": 100.0
    },
    "origin": "measured"
  },
  "outage_state": {
    "values": {
      "terrestrial_outage": false,
      "degraded": false
    },
    "origin": "inferred"
  },
  "privacy_constraints": {
    "values": {
      "location_precision": "named_test_zone",
      "contains_direct_identifiers": false,
      "retention_days": 30
    },
    "origin": "measured"
  },
  "continuity_requirements": {
    "values": {
      "class": "degraded_ok",
      "max_interruption_s": 120
    },
    "origin": "inferred"
  },
  "uncertainty": {
    "overall": "low",
    "notes": "Derived from Edge-IO batch; configured NTN parameters are not measured."
  },
  "missing_data_flags": [
    "device_to_device_availability",
    "blockage_state"
  ],
  "field_provenance": {
    "fields": {
      "network_state": "measured",
      "service_demand": "inferred",
      "spectrum_availability": "configured",
      "ntn_fallback_latency": "configured",
      "blockage_state": "missing",
      "device_to_device": "missing"
    }
  },
  "scenario_provenance": {
    "transformer": "seven_gc_twin.gate2.edge_ingest.v1",
    "generated_at": "2026-07-23T23:49:03Z",
    "notes": "Aggregated without modifying the source Edge-IO file."
  },
  "configuration_hash": "cb18d3ea73af4b8374aea51517e654e50cce1965cfe236400a776b066706510e",
  "evidence_level": "controlled_device_measurement",
  "producer": {
    "repository": "7gc-digital-twin",
    "commit": "fcc9b11df3be2205efc501e724745b6947563be7"
  },
  "n_users": 4,
  "service_profile": "learn_continuity",
  "measurement_quality": {
    "flags": [
      "ok",
      "physical_android",
      "unavailable_fields_explicit"
    ]
  }
}
