{
  "schema_name": "gunnchos.twin_state_bundle",
  "schema_version": "1.0.0",
  "run_id": "closed-loop-v2-gaza-twin",
  "site_id": "gaza",
  "source_measurement": {
    "summary": {
      "n_samples": 4,
      "mean_latency_ms": 42.0,
      "mean_jitter_ms": 3.0,
      "mean_packet_loss_pct": 0.4,
      "mean_upload_mbps": 12.0,
      "mean_download_mbps": 48.0,
      "dominant_network_type": "wifi",
      "workload_profile": "learn",
      "service_profile": "learn_continuity"
    },
    "sha256": "1ac8ef480ae365ccf54de50c346acb4faf89fc0ea9050998ac39d5f1f39f5328",
    "producer_repository": "edge-io-measurement-node",
    "producer_commit": "4f3095e349f522d6db9901b99101f3fe5dff9f6c"
  },
  "service_demand": {
    "values": {
      "service_profile": "learn_continuity",
      "geometry_fidelity": "AUTHORED_PLANNING_LAYOUT",
      "source_manifest_sha256": "520cbba99541b1505ebba899a2f34bfa905eadd7af8f5b5e8fa050c884067be1"
    },
    "origin": "configured"
  },
  "user_demands": [
    {
      "user_class": "learn",
      "priority": 2,
      "latency_budget_ms": 150.0,
      "bandwidth_mbps": 10.0,
      "origin": "configured"
    }
  ],
  "connectivity_candidates": [
    {
      "network": "terrestrial",
      "available": false,
      "estimated_latency_ms": 42.0,
      "estimated_capacity_mbps": 48.0,
      "origin": "configured"
    },
    {
      "network": "local_edge_wifi",
      "available": true,
      "estimated_latency_ms": 12.0,
      "estimated_capacity_mbps": 40.0,
      "origin": "configured"
    },
    {
      "network": "degraded_local",
      "available": true,
      "estimated_latency_ms": 58.8,
      "estimated_capacity_mbps": 12.0,
      "origin": "configured"
    },
    {
      "network": "ntn_fallback",
      "available": true,
      "estimated_latency_ms": 45.0,
      "estimated_capacity_mbps": 5.0,
      "origin": "configured"
    },
    {
      "network": "device_to_device",
      "available": false,
      "estimated_latency_ms": null,
      "estimated_capacity_mbps": null,
      "origin": "missing"
    },
    {
      "network": "offline_continuation",
      "available": true,
      "estimated_latency_ms": 0.0,
      "estimated_capacity_mbps": 0.0,
      "origin": "configured"
    }
  ],
  "network_state": {
    "values": {
      "dominant_network_type": "wifi",
      "mean_latency_ms": 42.0,
      "zones": [
        "GAZA.RECOVERY.OFFLINE_LEARNING_STUDIO",
        "GAZA.RECOVERY_NETWORK.SAFE_TEMPORARY_LEARNING_CIRCLE"
      ]
    },
    "origin": "inferred"
  },
  "spectrum_availability": {
    "values": {
      "budget_mhz": 20.0,
      "band_profile": "n78_planning"
    },
    "origin": "configured"
  },
  "compute_availability": {
    "values": {
      "local_edge": true,
      "offline_cache": true
    },
    "origin": "configured"
  },
  "mobility_state": {
    "values": {
      "class": "low_named_zone",
      "aggregate_only": true
    },
    "origin": "configured"
  },
  "blockage_state": {
    "values": {
      "scenario": "interior_partitions",
      "extra_db": 8.0
    },
    "origin": "configured"
  },
  "energy_constraints": {
    "values": {
      "budget_j": 80.0
    },
    "origin": "configured"
  },
  "outage_state": {
    "values": {
      "terrestrial_outage": true,
      "degraded": true
    },
    "origin": "configured"
  },
  "privacy_constraints": {
    "values": {
      "contains_direct_identifiers": false,
      "contains_person_path": false,
      "location_precision": "abstract_zone",
      "gaza_sensitive_export": false,
      "graham_station_claim": false
    },
    "origin": "configured"
  },
  "continuity_requirements": {
    "values": {
      "class": "offline_ok",
      "max_interruption_s": 180
    },
    "origin": "configured"
  },
  "uncertainty": {
    "overall": "high",
    "notes": "Planning projection; geometry_fidelity=AUTHORED_PLANNING_LAYOUT"
  },
  "missing_data_flags": [
    "surveyed_geometry",
    "measured_occupancy"
  ],
  "field_provenance": {
    "fields": {
      "network_state": "inferred",
      "service_demand": "configured",
      "geometry_fidelity": "configured"
    }
  },
  "scenario_provenance": {
    "transformer": "seven_gc_twin.integrations.campus_design.v1",
    "generated_at": "2026-09-27T00:18:23Z",
    "notes": "No surveyed geometry invented."
  },
  "configuration_hash": "feca514a64f3a722031ed568a8a19fab5684b1f4313bbabe0373daa853b8b842",
  "evidence_level": "synthetic",
  "producer": {
    "repository": "7gc-digital-twin",
    "commit": "4f3095e349f522d6db9901b99101f3fe5dff9f6c"
  },
  "n_users": 24,
  "service_profile": "learn_continuity"
}
